"Identifier","HCBusinessReferenceModelCode","Activity","Description"
"TRT.010.060 ",,"Temporary Duty (TDY) and Local Travel Voucher Processing and Audit ","Verify and update official station/residence location, travel location information, and departure/return dates; Determine and document value information for payment in kind from non-Federal source(s); Determine travel authorization/amended travel information associated with trip voucher; Verify and update Meals and Incidental Expenses (M&IE) per diem, transportation carrier fare, lodging, rental car, miscellaneous, special conveyance/transit system, and other expens information; Determine and document Privately Owned Vehicle (POV) expense information; Document M&IE information (if not using per diem); Determine and document additional emergency expense information associated with traveler illness or injury; Document expense receipts; Document updates to exception/justification information for use of non-standard transportation method or other travel policy deviation; Determine and document exchange rate adjustment information for conversion of expenses paid in foreign currency; Verify and update allocation percentage and dollar amounts for lines of accounting (LOA) code(s); Evaluate voucher/amended voucher information for completeness, errors, and compliance with policies; Revise voucher/amended voucher to correct issues; Submit and document voucher/amended voucher information for approval; Evaluate variance between estimated expenses on travel authorization and incurred expenses on voucher; Evaluate incurred costs and constructive costs for transportation and per diem, and determine reimbursable amount; Evaluate, route, and review voucher/amended voucher and record results Provide unapproved voucher/amended voucher, update to correct issues, and resubmit for approval; Determine funds availability for voucher/amended voucher payment; Approve and sign voucher/amended voucher; Request and confirm voucher/amended voucher payment disbursement; Match voucher/amended voucher payment disbursement confirmation to voucher and mark voucher as paid; Determine and document voucher/amended voucher status information; Document voucher/amended voucher, associated travel authorization, supporting documentation, and payment information for record retention "
"TRT.010.070 ",,"Temporary Duty (TDY) and Local Travel Monitoring and Reconciliation ","Identify and provide traveler notification of completed trip(s) with outstanding voucher(s); Process and match unused refundable ticket refund or non-refundable ticket value to travel authorization and billed account; Identify and document outstanding refunds owed by carrier for unused refundable tickets; Identify and document outstanding ticket value for future travel owed by carrier for unused non-refundable tickets; Determine and document penalty for accepting unauthorized payment for expenses from a non-Federal source; Develop and provide voucher and centrally billed account (CBA) reconciliation report information; Reconcile and provide centrally billed account (CBA) travel card account statement information against voucher information "
"TRT.010.080 ",,"Temporary Duty (TDY) and Local Travel Regulatory Reporting ","Develop and provide consolidated agency information for reporting on travel payments (Travel Reporting Information Profile [TRIP] Report); Develop and provide consolidated agency information for reporting on use of other than coach-class transportation accommodations (Premium Class Travel Report [PCTR]); Develop and provide consolidated agency information for reporting travel expenses paid by non-Federal sources; Develop and provide estimated improper travel payment information for agency reporting purposes "
"TRT.010.090 ",,"Temporary Duty (TDY) and Local Travel Management Reporting and Analysis ","Develop and provide standard travel report information; Provide standard travel report information errors and deficiencies; Develop ad hoc travel report content, including government-designated source of record; Develop and provide ad hoc travel report information; Evaluate ad hoc travel report information for errors and deficiencies, and revise content; Develop travel trends and patterns analysis report content, including government-designated source of record; Develop and provide travel trends and patterns analysis report information; Evaluate travel trends and pattern analysis report information for errors and deficiencies, and revise content; Evaluate and reconcile travel reporting and analysis information from multiple government-designated sources to identify inconsistencies, discrepancies, and errors, and provide results to appropriate parties "
"TRT.010.100 ",,"Temporary Duty (TDY) and Local Travel Policy Management and Audit","Document per diem and mileage reimbursement rates; Record documentary guidelines for government travel information; Document government-wide travel program information; Document list of agency approvers for travel documentation; Develop and document government-wide and approved agency-specific policies and associated compliance checks; Identify and document response information for request concerning travel guidance and policy information; Identify sample of vouchers and supporting documentation for audit; Evaluate vouchers, validate information and expenses, and record results; Identify, document, and provide improper travel payment information; Notify traveler of improper travel payment and request reimbursement; Request and confirm establishment of receivable for the traveler overpayment amount "
